"","user_id","screen_name","category","description","name","followers_count","profile_image_url","country"
"391","62619172","gladys_gonzalez","senators","Senadora Nacional por la provincia de Buenos Aires. Presidenta de la Comisión de Ambiente y Desarrollo Sustentable. Juntos por el Cambio. Mis proyectos 👇🏼","Gladys Gonzalez","58921","http://pbs.twimg.com/profile_images/1367176969557856256/At-gdCXn_normal.jpg","ar"
"392","148536486","gmmarangoni","others","Politólogo. Profesor universitario. Director @MyR_economia. Escribí #PolíticaATP https://t.co/5NuSfoV8Si","Gustavo Marangoni","31071","http://pbs.twimg.com/profile_images/1147107684312899584/eiPTn1Cw_normal.jpg","ar"
"393","883754195010158593","gondelcerro","deputies","DIPUTADO NACIONAL U.C.R.","Gonzalo del Cerro","1395","http://pbs.twimg.com/profile_images/885785119855915008/nN6Rrd_V_normal.jpg","ar"
"394","164335332","gracielaocana","deputies","Diputada Nacional. Presidenta de @confianzapubli. Me dicen la hormiguita 🐜 Lucho #ContraLaCorrupción","Graciela Ocaña","264283","http://pbs.twimg.com/profile_images/885989964722429952/17BWJhux_normal.jpg","ar"
"395","217169311","gsandleris","others","Profesor Investigador en la Universidad Torcuato Di Tella, coautor de Hay Equipo, bostero. Presidente del Banco Central de la República Argentina (2018/2019).","Guido Sandleris","33055","http://pbs.twimg.com/profile_images/1040590304351608832/5m350FFj_normal.jpg","ar"
"396","281180560","guillermosnopek","senators","Jujeño, abogado, con pasión y entrega por Jujuy.","Guillermo Snopek","4709","http://pbs.twimg.com/profile_images/1125384312491335681/GqDg83xb_normal.jpg","ar"
"397","867022208555732994","gustamenna","deputies","Abogado Patagónico. Esposo de Gabriela y papá de Mateo y Santiago. Docente universitario. Fana de San Lorenzo y Gimnasia (CR). Diputado Nacional por Chubut.","Gustavo Menna","7382","http://pbs.twimg.com/profile_images/872641617106268161/-OldN-Q3_normal.jpg","ar"
"398","890281511630626817","gustavohein_","deputies","Diputado Nacional por Entre Ríos #JuntosPorElCambio.
Casado y papá de dos hijas.","Gustavo Hein","1968","http://pbs.twimg.com/profile_images/1063806041513697285/2g_UaIVg_normal.jpg","ar"
"399","3028492511","gustavomelella","province servants","Gobernador de Tierra del Fuego, Antártida e Islas de Atlántico Sur.","Gustavo Melella","9707","http://pbs.twimg.com/profile_images/1388975879783604228/TlYxsrST_normal.jpg","ar"
"400","602332762","gustavoposse","province servants","Padre de Melchor y Macarena, Abogado, Intendente de San Isidro. Trabajo para la gente.
https://t.co/Oav0iOSsX9","Gustavo Posse","89953","http://pbs.twimg.com/profile_images/912744639505027073/lTs2qsjA_normal.jpg","ar"
"401","607590053","gustavovaldesok","province servants","Gobernador de la provincia de Corrientes.","Gustavo Valdés","42219","http://pbs.twimg.com/profile_images/1340114999533035523/b7PC4CwC_normal.jpg","ar"
"402","105180935","herlombardi","others","","Hernán Lombardi","263336","http://pbs.twimg.com/profile_images/887042609427996672/s11SmHYr_normal.jpg","ar"
"403","180392548","hernanberisso","deputies","Diputado Nacional por PRO @juntoscambioar 🇦🇷 Liberal #EstaryHacer.","Hernan Berisso","6565","http://pbs.twimg.com/profile_images/1266767570952208386/H8OoHCU7_normal.jpg","ar"
"404","707334512","hernanlacunza","others","Exministro de Hacienda de la Nación. Exministro de Economía de la Provincia","Hernán Lacunza","45329","http://pbs.twimg.com/profile_images/1224952238923272198/9XWNfWiX_normal.jpg","ar"
"405","187354449","herrerayflia","province servants","GOBERNADOR      PROVINCIA DE MISIONES","Oscar Herrera Ahuad","35665","http://pbs.twimg.com/profile_images/1204420528943063040/LqGuAcFc_normal.jpg","ar"
"406","77009449","horaciorlarreta","province servants","Jefe de Gobierno de @gcba. Lic en Economía (UBA). Fanático de Racing. Padre de tres hijas hermosas y esposo de una gran mujer.","Horacio Rodríguez Larreta ✋🏼🧼🤚🏼","1659391","http://pbs.twimg.com/profile_images/1371295010776363014/usLLMgGI_normal.jpg","ar"
"407","208700008","hperezaraujo","deputies","Padre. Peronista. De @Independiente. DT. Abogado. Diputado Nacional por la Provincia de La Pampa (2019/2023)","Hernán Pérez Araujo","2241","http://pbs.twimg.com/profile_images/1267493700118229000/O8P8sWUh_normal.jpg","ar"
"408","716750606334103552","igon_santiago","deputies","Diputado Nacional por Chubut, Frente De Todos. Cuenta oficial.","Igon Santiago","8657","http://pbs.twimg.com/profile_images/1379006382901506049/4WD8-NBc_normal.jpg","ar"
"409","339246511","ines_byd","province servants","🌟Mamá,riojana apasionada, abogada. Intendenta de La Rioja,Senadora Nacional MC. #UCR #JuntosXLaRioja #ElFamatinaNoSeToca En https://t.co/AN50BaU8Cy…","Inés Brizuela y Doria","12983","http://pbs.twimg.com/profile_images/1207815771688226816/Z6QO8YoS_normal.jpg","ar"
"410","779498837236916224","insfran_gildo","province servants","Gobernador de la Provincia de Formosa. Peronista de corazón. Cuenta oficial en Twitter ❤️✌️","Gildo Insfrán","13086","http://pbs.twimg.com/profile_images/1063458118586241035/qwi6Don3_normal.jpg","ar"
"411","4919962521","inst_PATRIAar","others","Pensamiento, Acción y Trabajo para la Inclusión Americana | Fb: https://t.co/Jj1ysKku2x | Videos: https://t.co/pVEKwcnEgw","Instituto PATRIA","111640","http://pbs.twimg.com/profile_images/917755585487044610/P3cmEuF3_normal.jpg","ar"
"412","150123282","ipetrella","others","DM abierto. Joint fellow @HarvardEthics @BKCHarvard. Fui director de Argentina 2030 en Casa Rosada y secretario de cultura. Tango, religiones y chocolate amargo","Ivan Petrella","30864","http://pbs.twimg.com/profile_images/658778384860844033/hWQKy-Af_normal.jpg","ar"
"413","118784071","jaicega","deputies","-Diputado de la Nación 
Cambiemos-Pro.
-Abogado Magister en Derecho de la Empresa.

-Hincha de Estudiantes- Bilardista.               

-Padre de 4 hijos.","Juan Aicega","2928","http://pbs.twimg.com/profile_images/1335219669838467076/8kFOvRtF_normal.jpg","ar"
"414","1242641029737656321","javiercamposok","deputies","Diputado Nacional. Coalición Cívica ARI-Juntos por el Cambio. Trabajando por una República que deje atrás las contradicciones que nos empobrecen.","Javier Campos","1479","http://pbs.twimg.com/profile_images/1242642337370603520/Wfy76yRq_normal.jpg","ar"
"415","351953986","jlespert","others","Doctor en Economía UCEMA. Ex Candidato a Presidente de la Nación (2019). Mis libros: La Argentina Devorada(2017), La Sociedad Cómplice (2019) y No Va Más (2020)","Jose Luis Espert","495167","http://pbs.twimg.com/profile_images/1311012287004774400/0JcTVDwx_normal.jpg","ar"
"416","143852870","jmcapitanich","province servants","Gobernador de la Provincia del Chaco.","Jorge Capitanich","254876","http://pbs.twimg.com/profile_images/1308210383224745986/Atm4m_TD_normal.jpg","ar"
"417","155044742","jorgeelacoste","deputies","Diputado de la Nación por UCR ✒ 

Ex Intendente de Sauce de Luna 🇵🇱

Comprometido con mi Provincia 💪","Jorge E. Lacoste","1648","http://pbs.twimg.com/profile_images/1253012301126471680/Cj4_7sHE_normal.jpg","ar"
"418","730423200996274176","jorgeferraresi","national executive","Ministro de @MinHabitatAR. Militante Popular. Hincha del bicho.
Facebook: https://t.co/SMsSWKCFkK… Instagram: https://t.co/aCNOnlWRsG","Jorge Ferraresi","62437","http://pbs.twimg.com/profile_images/1380591035789799424/33LT4xB8_normal.jpg","ar"
"419","38494089","jorgemacri","province servants","Intendente de Vicente López. Papá de tres hijos maravillosos. Hincha de River y amante de la cocina.","Jorge Macri","189343","http://pbs.twimg.com/profile_images/1055885506402246656/pQi7T43l_normal.jpg","ar"
"420","233577586","joselriccardo","deputies","Profesor. Diputado de la Nación. Presidente de la Comisión de Ciencia y Tecnología de la HCDN. Doctor en Física. Ex Rector de la UNSL 2007-13.","Jose Riccardo","3859","http://pbs.twimg.com/profile_images/922555239366123522/LAaFeI5l_normal.jpg","ar"
"421","19722366","joseluisgioja","deputies","Diputado Nacional - Vicepresidente 2° de la Cámara de Diputados de la Nación. Tres veces gobernador de la Provincia de San Juan.","José Luis Gioja","104454","http://pbs.twimg.com/profile_images/1244441714137477122/KJUvxD_r_normal.jpg","ar"
"422","203147154","josenunezjurado","deputies","Santafesino de Piñero.
Diputado Nacional por cambiemos 2015-2019 mandato cumplido y por JXC 2019-2023.","José Núñez","5307","http://pbs.twimg.com/profile_images/1277615985265164289/fwvmK75o_normal.jpg","ar"
"423","307976282","jromero581","deputies","Contador Público. Diputado Nacional bloque @Diputados_Todos. Correntino y Peronista. Casado con Lilian. Papá de Ailín, Jazmín y Lautaro.","Jorge Antonio Romero","1043","http://pbs.twimg.com/profile_images/1304568649211092993/9Ubyu5z9_normal.jpg","ar"
"424","148752676","juanabalmedina","others","Politólogo, Profesor Titular de la UBA, Investigador del CONICET, hincha de River y peronista k.","Juan Abal Medina","210730","http://pbs.twimg.com/profile_images/1378315255500185602/zPG5ZQ0P_normal.jpg","ar"
"425","27515656","juancabandie","national executive","Papá de Pedro y Ciro Néstor. Ministro de Ambiente y Desarrollo Sostenible. Riquelmista","Juan Cabandié","246706","http://pbs.twimg.com/profile_images/1380616341414105089/mnDw09Rh_normal.jpg","ar"
"426","77897441","juancurutchet","others","Abogado. Ex Presidente Banco Provincia. Padre orgulloso de tres hijos.","Juan Curutchet","16166","http://pbs.twimg.com/profile_images/819952270578249730/4gxMa24a_normal.jpg","ar"
"427","1095773453855137794","juanjomalvinas","others","Argentino 🇦🇷 Veterano de Guerra de Malvinas. Al mundo lo cambia tu ejemplo, no tu opinión. Excandidato a Presidente de la Nación.","Juan José Gómez Centurión","65483","http://pbs.twimg.com/profile_images/1378534634355621891/nBAjH32j_normal.jpg","ar"
"428","3300047038","juanmariopais","senators","Senador Nacional por la Provincia de Chubut. Abogado. Peronista. También en https://t.co/7KdFGdCk0I e Instagram: @senadorpais","Juan Mario Pais","4285","http://pbs.twimg.com/profile_images/710520600687677440/bUukTjKh_normal.jpg","ar"
"429","1204880494288093184","juanvazquezdip","deputies","Diputado Nacional por la Provincia de Santa Cruz. Frente de Tod🌞s. Ex Intendente de Gobernador Gregores.
#ArgentinaDePie 🇦🇷✌","Juan Benedicto Vázquez","478","http://pbs.twimg.com/profile_images/1204881765124464640/1Mn8gI75_normal.jpg","ar"
"430","18466094","juliocobos","senators","Mendocino, padre, abuelo, ingeniero y radical. Fui Gobernador de Mendoza y Vicepresidente de Argentina. Senador Nacional UCR. 🇦🇷","Julio Cobos","197764","http://pbs.twimg.com/profile_images/1203343908295626752/8cp9kqu3_normal.jpg","ar"
"431","161308045","jusgobar","national executive","Ministerio de Justicia y Derechos Humanos de la Nación","Min. Justicia y DDHH","135728","http://pbs.twimg.com/profile_images/1387399200246272008/7RbZizvD_normal.jpg","ar"
"432","519497576","larroqueandres","deputies","Militante del Movimiento Nacional Justicialista. Secretario General de La Cámpora. Ministro de @MinDesarrolloBA.","Andrés Larroque","114823","http://pbs.twimg.com/profile_images/729818743526834176/eDvSeQoK_normal.jpg","ar"
"433","23677018","lauritalonso","others","en búsqueda permanente de la cuadratura del círculo. la libertad y la educación son la base del progreso. sarmiento fan. tweets are my own","soy laura","345809","http://pbs.twimg.com/profile_images/1389280404755165187/k4D3xNI__normal.jpg","ar"
"434","1631369960","laurmachado","senators","Abogada. Senadora Nacional (2015-2021). Vicepresidente segunda del PRO Nacional. Vicepresidente segunda del Senado de la Nación.","Laura Rodríguez Machado","22098","http://pbs.twimg.com/profile_images/878306999544532992/ayAyqxrO_normal.jpg","ar"
"435","3365136485","leonormartinezv","deputies","Diputada Nacional por Coalición Cívica ARI Córdoba. Juntos por el Cambio 💪🏽","Leonor Martinez Villada","3071","http://pbs.twimg.com/profile_images/1339316557705584640/QOdgIZHE_normal.jpg","ar"
"436","717048187274575874","ljuez","deputies","Diputado Nacional por Córdoba 🇦🇷.","Luis Alfredo Juez","48796","http://pbs.twimg.com/profile_images/1267805528778051589/K5dneDOf_normal.jpg","ar"
"437","330546547","lmetchevehere","others","Entrerriano y de Boca de nacimiento. Ex-Ministro de Agricultura, Ganadería y Pesca de la Nación.","Luis Etchevehere","40042","http://pbs.twimg.com/profile_images/1345117478104551425/nyeuRWuH_normal.jpg","ar"
"438","703482990","lorematzen","deputies","Diputada Nacional por la Provincia de Río Negro. Radical desde el alma, fan de Arturo Illia y Raúl Alfonsín. Hincha de Boca.","Lorena Matzen","5378","http://pbs.twimg.com/profile_images/1344371197409189890/0Q9BuMyS_normal.jpg","ar"
"439","527663666","ludeponti","province servants","Santafesina y sabalera 🙋🏻 Militante feminista del Evita y la CTEP ✌🏻Diputada Provincial - Diputada Nacional (Mandato Cumplido) 🏛","Lucila De Ponti","31767","http://pbs.twimg.com/profile_images/1382700070257168385/6Ad5lOBx_normal.jpg","ar"
"440","277287300","luisnaidenoff","senators","Senador Nacional por Formosa. Presidente del Interbloque de Juntos por el Cambio y del Bloque UCR en la Cámara Alta. Hincha de Boca.","Luis Naidenoff","34812","http://pbs.twimg.com/profile_images/1227667349047775233/_Kq8moPI_normal.jpg","ar"
"441","206747178","luispastori","deputies","Diputado de la Nación -Período 2013/2017- UCR Misiones  - Diputado Provincial (M.C.)- Contador Público Nacional y Profesor Universitario en Ciencias Económicas.","Luis Mario Pastori","5975","http://pbs.twimg.com/profile_images/418372189818060801/YrjvF_kV_normal.jpeg","ar"
"442","52439980","luispetri","deputies","Diputado Nacional UCR -Juntos por el Cambio, abogado, apasionado y voluntarioso, enamorado de mi provincia, Mendoza.","Luis Petri","50439","http://pbs.twimg.com/profile_images/1293538534457061378/ZRQbRWB7_normal.jpg","ar"
"443","2415876295","mabyburgos","deputies","Jujeña con mucho orgullo. Diputada Nacional por la UCR - Abogada. Lo más importante, MADRE de EDU... el motor de mi vida.","Gabriela Burgos","6547","http://pbs.twimg.com/profile_images/1198781734004895744/sChfcXXt_normal.jpg","ar"
"444","1584076484","magariovero","province servants","Vicegobernadora de la provincia de Buenos Aires. Intendenta de #LaMatanza (2015 - 2019). Mamá de Lucas y Camilo.","Verónica Magario","173327","http://pbs.twimg.com/profile_images/1300249618643595264/vlRqMGcE_normal.jpg","ar"
"445","205380227","magdysierra","deputies","Militante Peronista, Arquitecta y de Racing✌. Jefa de Gabinete en @gestion_a.","Magdalena Sierra","9269","http://pbs.twimg.com/profile_images/1297240737915064322/b7PShvkn_normal.jpg","ar"
"446","159964842","maluisastorani","others","Militante RADICAL y feminista, desde siempre y para siempre. Parlamentaria del Mercosur 💚","Maria Luisa Storani","14109","http://pbs.twimg.com/profile_images/1367872182169329666/YnZwALr0_normal.jpg","ar"
"447","593781032","mara_ruiz_malec","province servants","Ministra de Trabajo de la Provincia de Buenos Aires. Economista.
Hincha de @CAVSCoficial","Mara Ruiz Malec 💚","9839","http://pbs.twimg.com/profile_images/1236001573312114693/t_m757MR_normal.jpg","ar"
"448","155740660","marcoscleri","deputies","Trabajador, militante Proyecto Nacional, La Cámpora. Abogado. Docente UNR. Diputado Nacional. El Sueño Colectivo es Invencible.#FrenteDeTodos #UnidadCiudana 🌞","Marcos Cleri","13380","http://pbs.twimg.com/profile_images/1378269057250627584/AmtMxYel_normal.jpg","ar"
"449","134910253","marianorecalde","senators","Abogado. Docente. Padre de María Eva, Sara y Juan Pedro. Senador nacional por la Ciudad de Buenos Aires. Presidente del @PJCiudad.","Mariano Recalde","240547","http://pbs.twimg.com/profile_images/1289545208670158848/Rnk-QeI2_normal.jpg","ar"
"450","3237099209","marioaleito","deputies","Diputado nacional por Tucumán (FDT). Congresal nacional del @p_justicialista. Presidente del Club @ATOficial. Vicepresidente 3° de @LigaAFA.","Mario Leito","6198","http://pbs.twimg.com/profile_images/1386695594438234120/DEtSY9X7_normal.jpg","ar"
"451","234441059","mariomeoni","national executive","Ministro de Transporte de la Nación 🇦🇷

Esposo de Laura y papá de Felipe y Robertino

Hincha de Sarmiento de Junín","Mario Meoni","33914","http://pbs.twimg.com/profile_images/1380662258179641349/EFc3v6Xc_normal.jpg","ar"
"452","267784293","marioraulnegri","deputies","Diputado Nacional - Córdoba - Presidente del Bloque UCR y del Interbloque Juntos por el Cambio.","Mario Raúl Negri","201947","http://pbs.twimg.com/profile_images/1042446986371321858/ZVKQC5TA_normal.jpg","ar"
"453","109040582","mariuvidal","others","Mamá orgullosa de Camila, María José y Pedrito.","María Eugenia Vidal","1631746","http://pbs.twimg.com/profile_images/1375055005619748870/OXJPIkS__normal.jpg","ar"
"454","29622459","marquitospena","others","","Marcos Peña","814793","http://pbs.twimg.com/profile_images/1191762016643506176/yr9QMtyJ_normal.jpg","ar"
"455","180536299","martinezdolom","deputies","Diputada Nacional por #CABA
Antes, Directora de Modernización Parlamentaria en @DiputadosAR. Politóloga #UBA #ParlamentoAbierto
#EvolucionRadical 🇲🇨","Dolores Martinez","2777","http://pbs.twimg.com/profile_images/1150904275259789317/bPTjW_9S_normal.jpg","ar"
"456","24900072","mauriciomacri","others","Ex presidente de la República Argentina. Miembro fundador de PRO Argentina y Cambiemos. Casado. 4 hijos. Hincha de Boca.","Mauricio Macri","5123468","http://pbs.twimg.com/profile_images/653558348273569792/joxg8DZD_normal.png","ar"
"457","169579393","mauricloss","senators","Senador Nacional por la Provincia de Misiones","Maurice Closs","39429","http://pbs.twimg.com/profile_images/1270829809279606784/u-OhIjmU_normal.jpg","ar"
"458","112822128","mayrasmendoza","province servants","Intendenta de @QuilmesMuni.","Mayra Mendoza ☀️","163993","http://pbs.twimg.com/profile_images/1062396891743313921/CE7Q61gA_normal.jpg","ar"
"459","143689068","minsaurralde","province servants","Intendente del @MunicipioLdeZ.","Martín Insaurralde","361524","http://pbs.twimg.com/profile_images/751849573400928256/XcwA5DeD_normal.jpg","ar"
"460","1911186721","mirabellarob","senators","Senador Nacional por la provincia de Santa Fe","Roberto Mirabella","4106","http://pbs.twimg.com/profile_images/1065260991200591873/LMThQgfe_normal.jpg","ar"
"461","549562216","mirtatundis","deputies","Diputada Nacional - Frente de TOD☀️S","Mirta Tundis","21437","http://pbs.twimg.com/profile_images/892463353880293377/z5bBq74I_normal.jpg","ar"
"462","829043697421533184","mmlosardo","national executive","Abogada.","Marcela Losardo","31972","http://pbs.twimg.com/profile_images/1375065123405115392/WLyhbVwl_normal.jpg","ar"
"463","284783298","monzoemilio","others","Dirigente político. Abogado. Casado, cinco hijos.","Emilio Monzó","59844","http://pbs.twimg.com/profile_images/1388493279013056513/gAgjcIqb_normal.jpg","ar"
"464","189980904","mpcasaretto","deputies","Contador Publico. Profesor Universitario. Vicepresidente Echagüe de Paraná. Diputado Nacional Frente de Todos 2019-2023","Marcelo Casaretto","1530","http://pbs.twimg.com/profile_images/1150146564234653696/D3lUY04x_normal.png","ar"
"465","35799843","mpiccolomini","deputies","Diputada Nacional por la Provincia de Buenos Aires @proargentina @juntoscambioar","María Carla Piccolomini","1317","http://pbs.twimg.com/profile_images/1056976946171691008/kyykKElb_normal.jpg","ar"
"466","1069556234","mrmartinez55","deputies","Diputada Nacional por la Provincia de Buenos Aires @frentedetodos
Militante del proyecto Nacional, Popular, Democrático y Feminista.","Maria Rosa Martinez","4381","http://pbs.twimg.com/profile_images/1371444248185307141/Vh8B-bS7_normal.jpg","ar"
"467","144929758","msalnacion","national executive","Cuenta oficial del Ministerio de Salud de la Nación 🇦🇷","Ministerio de Salud de la Nación","546709","http://pbs.twimg.com/profile_images/1387402838956036102/FOtR86BF_normal.jpg","ar"
"468","300602136","muramartin","province servants","Ministro de Hacienda y Finanzas del Gobierno de la Ciudad de Buenos Aires. Enamorado de mis Coloradas, Nina e India👼. Hincha del Rojo.","Martin Mura","2429","http://pbs.twimg.com/profile_images/1371439306087227394/VS3PD_0__normal.jpg","ar"
"469","332993154","myriambregman","province servants","PTS/Frente de Izquierda. Abogada defensora de las libertades democráticas y de trabajadorxs. Diputada CABA 2018/2021.","Myriam Bregman","161101","http://pbs.twimg.com/profile_images/1334634693778690049/tbGKa-xt_normal.jpg","ar"
"470","174409008","nancysgonzalez","senators","Militante Peronista, Senadora Nacional por la Provincia de Chubut","Nancy Gonzalez","9828","http://pbs.twimg.com/profile_images/1014861608152072192/xRk_pNEu_normal.jpg","ar"
"471","257432060","nestorpitrola","others","Dirigente nacional del @PartidoObrero en el Frente de Izquierda","Néstor Pitrola","50128","http://pbs.twimg.com/profile_images/1124077949651648514/N5ODV9Vx_normal.png","ar"
"472","198756401","nilda_garre","others","Secretaria Ejecutiva del Centro de Estudios Estratégicos para la Defensa “Manuel Belgrano” (CEEPADE)","Nilda Garré","151613","http://pbs.twimg.com/profile_images/628025313671409664/AYESgvBX_normal.jpg","ar"
"473","888107793000968195","noragimenezok","senators","Senadora Nacional por #Salta, #FrenteDeTodos","Nora del Valle Gimenez","1017","http://pbs.twimg.com/profile_images/1375450163846787072/_FNQHLCH_normal.jpg","ar"
"474","208776673","omarchafifelix","deputies","Casado con Alejandra, padre de 3 hijos. Militante político. Ex-Intendente de San Rafael. Diputado Nacional por Mendoza.","Omar Félix","4603","http://pbs.twimg.com/profile_images/929586257709228034/e6X81MD8_normal.jpg","ar"
"475","40741753","omardemarchi","deputies","Diputado Nacional Pro, Luján de Cuyo, Mendoza. 
Siempre mirando adelante.
Ser revolucionario en Argentina es intentar el equilibrio fiscal.
El populismo atrasa.","Omar De Marchi","22160","http://pbs.twimg.com/profile_images/1202017304218886145/J7FjRNdM_normal.jpg","ar"
"476","61631756","omarperotti","province servants","Gobernador de Santa Fe.","Omar Perotti","50501","http://pbs.twimg.com/profile_images/1242778720630439942/ZWoNNdxu_normal.jpg","ar"
"477","95970921","pabloavelluto","others","Fui cadete, docente, periodista, editor, secretario y ministro entre otras cosas. Políticamente incorrecto y contrario a cualquier fanatismo. Insulto=bloqueo.","Pablo Avelluto","37637","http://pbs.twimg.com/profile_images/1191407744542216192/_d1lOHsB_normal.jpg","ar"
"478","1304555474596093954","paolavessvess","deputies","Diputada Nacional de la Provincia de Santa Cruz. 
República Argentina. @Frentedetodos","Paola Vessvessian","370","http://pbs.twimg.com/profile_images/1304565813177921537/FeUKz3LX_normal.jpg","ar"
"479","179679166","parola_graciela","deputies","Formoseña, Peronista y de Gildo Insfrán!!!...Diputada Nacional por Formosa...Mi madre, mi ejemplo. ❤✌","Maria G Parola","188","http://pbs.twimg.com/profile_images/909042148137406464/sXBwhF3L_normal.jpg","ar"
"480","2333002839","patriciamounier","deputies","Docente 👩‍🏫
Secretaria Adjunta de @sadopsantafe
Secretaria de DDHH de @sadopnacion
Diputada Nacional por Santa Fe - @FrenteDeTodos  ☀️ 🇦🇷","Patricia Mounier","1821","http://pbs.twimg.com/profile_images/1242798279194284034/LOKaBy3G_normal.jpg","ar"
"481","380741459","pau_oliveto","deputies","Diputada Nacional y Presidente de la Coalición Cívica-ARI de la Ciudad de Buenos Aires","Paula Oliveto","152419","http://pbs.twimg.com/profile_images/812018016980496384/hM1eBa8p_normal.jpg","ar"
"482","974700736775847937","paulocassinerio","deputies","Diputado de la Nación por la Provincia de Córdoba. Miembro del Bloque @CordobaFederal | Facebook: paulocassinerio | Instagram: paulolcassinerio","Paulo Cassinerio","4092","http://pbs.twimg.com/profile_images/976198912716492800/gwyBcYFh_normal.jpg","ar"
"483","226552041","pilattivergara","senators","Senadora Nacional FPV- Chaco. Militante . Abogada","Marín Pilatti","8434","http://pbs.twimg.com/profile_images/1128633090744758273/4zxyU5zS_normal.jpg","ar"
"484","18143118","proargentina","others","Somos un equipo de argentinos presentes en todas las provincias, unidos por el interés en el futuro y la convicción de que podemos hacer un país mejor.","PRO","251944","http://pbs.twimg.com/profile_images/1293342070984380416/jH7fzGKz_normal.jpg","ar"
"485","627904763","produccion_arg","national executive","Cuenta oficial del Ministerio de Desarrollo Productivo de la República Argentina.","Ministerio de Desarrollo Productivo","250936","http://pbs.twimg.com/profile_images/1387408091055071236/tQbOQILM_normal.jpg","ar"
"486","163162392","pyedlin","deputies","Diputado Nacional por Tucumán. Presidente de la Comisión de Acción Social y Salud Pública de @diputadosar. Ministro de Salud de Tucumán 2007-2015.","Dr. Pablo Yedlin","12079","http://pbs.twimg.com/profile_images/1234211434562756611/ctHWINEz_normal.jpg","ar"
"487","2831711691","ramirofpatri","deputies","Diputado Nacional del FDT, por Formosa | Lic. en Administración (UBA) Partido Justicialista - Arg.","RamiroFernandezPatri","2347","http://pbs.twimg.com/profile_images/1384192846727548948/6Upzpqxr_normal.jpg","ar"
"488","60534269","rctagliaferro","others","Lic. en Ciencias Políticas (UCA). Ex Intendente de Morón. Última generación de potrero. Cuervo y enganche.","Ramiro Tagliaferro","28732","http://pbs.twimg.com/profile_images/1204827611421167616/vA6CTEeH_normal.jpg","ar"
"489","174010839","rgillavedra","others","Abogado, hincha de Racing. Padre de 4 hijos y abuelo de Astor, Antígona y Fermín","Ricardo Gil Lavedra","82599","http://pbs.twimg.com/profile_images/3659823510/00f902fb3a787345131eb6506bd41429_normal.jpeg","ar"
